Keyword,Intent,Volume,Trend,Keyword Difficulty,Competitive Density
book báo chí,Informational,110,"0.64,0.79,1.00,1.00,0.79,0.79,0.79,0.79,0.36,0.79,0.64,0.64",12,0.27
booking báo chí,Informational,110,"0.64,0.79,1.00,1.00,0.79,0.79,0.79,0.79,0.36,0.79,0.64,0.64",8,0.27
book báo điện tử,Informational,30,"0.11,0.11,0.56,0.11,0.22,0.56,0.11,1.00,0.56,0.11,0.56,0.00",10,0.00
booking báo vnexpress,Informational,30,"0.57,0.14,0.71,0.14,0.14,0.43,0.71,0.43,0.14,1.00,0.14,0.14",5,0.38
booking báo điện tử,Informational,30,"1.00,0.78,0.11,0.11,0.11,0.11,1.00,0.11,0.11,0.22,0.11,0.11",10,0.80
booking quảng cáo báo,Informational,30,"0.78,0.22,0.11,0.22,0.11,0.11,0.11,1.00,0.11,0.33,0.11,0.11",12,0.57
báo giá booking kols,Informational,30,"0.44,0.11,0.33,0.11,1.00,0.56,0.56,0.11,0.11,0.11,0.11,0.11",7,0.29
agency booking báo chí,,20,"1.00,0.25,0.25,0.25,0.50,0.25,0.25,0.25,0.25,0.75,0.25,0.50",,0.62
book báo pr,,20,"0.20,0.20,0.20,1.00,0.60,0.60,0.20,0.20,0.20,1.00,0.20,0.80",,0.53
booking báo,,20,"0.80,0.40,0.20,0.20,0.20,0.20,0.20,1.00,0.40,0.20,0.40,0.60",,0.66
booking báo online,,20,"0.67,0.33,0.33,0.33,0.33,1.00,0.33,0.33,0.33,1.00,0.33,0.67",,0.29
liên hệ book báo,,20,"0.40,0.60,0.20,0.20,0.20,1.00,0.20,0.40,0.20,0.20,0.20,0.20",,0.86
agency booking báo,,10,"0.33,0.33,0.33,0.33,1.00,0.33,0.33,1.00,0.33,0.33,0.33,0.33",,0.61
booking bài báo,,10,"0.00,0.00,0.14,0.00,0.00,0.14,1.00,0.00,0.29,0.14,0.14,0.00",,0.00
agency book bài pr trên báo cnn,,0,"0.00,0.00,0.00,0.00,0.00,0.00,0.00,0.00,0.00,0.00,0.00,0.00",,0.00
agency book bài pr trên các báo nước ngoài,,0,"0.00,0.00,0.00,0.00,0.00,0.00,0.00,0.00,0.00,0.00,0.00,0.00",,0.00
agency book bài pr được các báo online nước ngoài,,0,"0.00,0.00,0.00,0.00,0.00,0.00,0.00,0.00,0.00,0.00,0.00,0.00",,0.00
book bài pr trên báo nước ngoài cnn,,0,"0.00,0.00,0.00,0.00,0.00,0.00,0.00,0.00,0.00,0.00,0.00,0.00",,0.00
book bài pr trên báo nước ngoài time,,0,"0.00,0.00,0.00,0.00,0.00,0.00,0.00,0.00,0.00,0.00,0.00,0.00",,0.00
book báo chí la gi,,0,"0.00,0.00,0.00,0.00,0.00,0.00,0.00,0.00,0.00,0.00,0.00,0.00",,0.00
book king báo mạng,,0,"0.00,0.00,0.00,0.00,0.00,0.00,0.00,0.00,0.00,0.00,0.00,0.00",,0.00
book statement báo cáo kiểm tra sổ sách,,0,"0.00,0.00,0.00,0.00,0.00,0.00,0.00,0.00,0.00,0.00,0.00,0.00",,0.00
book địa điểm trước khi họp báo,,0,"0.00,0.00,0.00,0.00,0.00,0.00,0.00,0.00,0.00,0.00,0.00,0.00",,0.00
booking bài pr báo batdongsan.com.vn,,0,"0.00,0.00,0.00,0.00,0.00,0.00,0.00,0.00,0.00,0.00,0.00,0.00",,0.00
booking bài pr báo online,,0,"0.00,0.00,0.00,0.00,0.00,0.00,0.00,0.00,0.00,0.00,0.00,0.00",,0.00
booking báo cafebiz,,0,"0.00,0.00,0.00,0.00,0.00,0.00,0.00,0.00,0.00,0.00,0.00,0.00",,0.00
booking báo chỉ,,0,"0.00,0.00,0.00,0.00,0.00,0.00,0.00,0.00,0.00,0.00,0.00,0.00",,0.00
booking báo doanh nhân sài gòn cuối tuần,,0,"0.00,0.00,0.00,0.00,0.00,0.00,0.00,0.00,0.00,0.00,0.00,0.00",,0.00
booking báo dân trí,,0,"0.00,0.00,0.00,0.00,0.00,0.00,0.00,0.00,0.00,0.00,0.00,0.00",,0.00
booking báo forbes,,0,"0.00,0.00,0.00,0.00,0.00,0.00,0.00,0.00,0.00,0.00,0.00,0.00",,0.00
booking báo mạng,,0,"0.00,0.00,1.00,0.00,0.00,0.00,0.00,0.00,0.00,0.00,0.00,0.33",,0.38
booking báo phụ nữ online,,0,"0.00,0.00,0.00,0.00,0.00,0.00,0.00,0.00,0.00,0.00,0.00,0.00",,0.00
booking báo sinh viên việt nam,,0,"0.00,0.00,0.00,0.00,0.00,0.00,0.00,0.00,0.00,0.00,0.00,0.00",,0.00
booking báo worksheet resort,,0,"0.00,0.00,0.00,0.00,0.00,0.00,0.00,0.00,0.00,0.00,0.00,0.00",,0.00
booking báo worksheetresort,,0,"0.00,0.00,0.00,0.00,0.00,0.00,0.00,0.00,0.00,0.00,0.00,0.00",,0.00
booking báo worksheets resort,,0,"0.00,0.00,0.00,0.00,0.00,0.00,0.00,0.00,0.00,0.00,0.00,0.00",,0.00
booking báo đeiu tử,,0,"0.00,0.00,0.00,0.00,0.00,0.00,0.00,0.00,0.00,0.00,0.00,0.00",,0.00
booking báo đài,,0,"0.00,0.00,0.00,0.00,0.00,0.00,0.00,0.00,0.00,0.00,0.00,0.00",,0.00
booking quảng cáo báo giấy,,0,"0.00,0.00,0.00,0.00,0.00,0.00,0.00,0.00,0.00,0.00,0.00,0.00",,0.00
booking quảng cáo báo mạng,,0,"0.00,0.00,0.00,0.00,0.00,0.00,0.00,0.00,0.00,0.00,0.00,0.00",,0.00
booking quảng cáo báo nhịp cầu đầu tư,,0,"0.00,0.00,0.00,0.00,0.00,0.00,0.00,0.00,0.00,0.00,0.00,0.00",,0.00
booking quảng cáo thời báo kinh tế việt nam,,0,"0.00,0.00,0.00,0.00,0.00,0.00,0.00,0.00,0.00,0.00,0.00,0.00",,0.00
booking trên báo tiền phong,,0,"0.00,0.00,0.00,0.00,0.00,0.00,0.00,0.00,0.00,0.00,0.00,0.00",,0.00
books trang tải báo,,0,"0.00,0.00,0.00,0.00,0.00,0.00,0.00,0.00,0.00,0.00,0.00,0.00",,0.00
books.org trang tải báo,,0,"0.00,0.00,0.00,0.00,0.00,0.00,0.00,0.00,0.00,0.00,0.00,0.00",,0.00
báo cáo kiểm tra sổ sách statement of books,,0,"0.00,0.00,0.00,0.00,0.00,0.00,0.00,0.00,0.00,0.00,0.00,0.00",,0.00
báo cáo lỗi cho face book,,0,"0.00,0.00,0.00,0.00,0.00,0.00,0.00,0.00,0.00,0.00,0.00,0.00",,0.00
báo gia lai booking quảng cáo,,0,"0.00,0.00,0.00,0.00,0.00,0.00,0.00,0.00,0.00,0.00,0.00,0.00",,0.00
báo giá book bài pr trên vnexpress,,0,"0.00,0.00,0.00,0.00,0.00,0.00,0.00,0.00,0.00,0.00,0.00,0.00",,0.00
báo giá booking afamily.vn,,0,"0.00,0.00,0.00,0.00,0.00,0.00,0.00,0.00,0.00,0.00,0.00,0.00",,0.00
báo giá booking banner web cafeland,,0,"0.00,0.00,0.00,0.00,0.00,0.00,0.00,0.00,0.00,0.00,0.00,0.00",,0.00
báo giá booking bài pr admicro,,0,"0.00,0.00,0.00,0.00,0.00,0.00,0.00,0.00,0.00,0.00,0.00,0.00",,0.00
báo giá booking báo công luận,,0,"0.00,0.00,0.00,0.00,0.00,0.00,0.00,0.00,0.00,0.00,0.00,0.00",,0.00
báo giá booking báo đẹp,,0,"0.00,0.00,0.00,0.00,0.00,0.00,0.00,0.00,0.00,0.00,0.00,0.00",,0.00
báo giá booking cafebiz,,0,"0.00,0.00,0.00,0.00,0.00,0.00,0.00,0.00,0.00,0.00,0.00,0.00",,0.00
báo giá booking chuyển động 24h,,0,"0.00,0.00,0.00,0.00,0.00,0.00,0.00,0.00,0.00,0.00,0.00,0.00",,0.00
báo giá booking cpd banner homepage web cafeland,,0,"0.00,0.00,0.00,0.00,0.00,0.00,0.00,0.00,0.00,0.00,0.00,0.00",,0.00
báo giá booking doanhnghiepphattrien,,0,"0.00,0.00,0.00,0.00,0.00,0.00,0.00,0.00,0.00,0.00,0.00,0.00",,0.00
báo giá booking doanhnghiepphattrien.vn,,0,"0.00,0.00,0.00,0.00,0.00,0.00,0.00,0.00,0.00,0.00,0.00,0.00",,0.00
báo giá booking fanpage,,0,"0.00,0.00,0.00,0.00,0.00,0.00,0.00,0.00,0.00,0.00,0.00,0.00",,0.00
báo giá booking kientrucvietnam.org,,0,"0.00,0.00,0.00,0.00,0.00,0.00,0.00,0.00,0.00,0.00,0.00,0.00",,0.00
báo giá booking kols 2019,,0,"0.00,0.00,0.00,0.00,0.00,0.00,0.00,0.00,0.00,0.00,0.00,0.00",,0.00
báo giá booking pr vnexpress,,0,"0.00,0.00,0.00,0.00,0.00,0.00,0.00,0.00,0.00,0.00,0.00,0.00",,0.00
báo giá booking quảng cáo,,0,"0.00,0.00,0.00,0.00,0.00,0.00,0.00,0.00,0.00,0.00,0.00,0.00",,0.00
báo giá booking quảng cáo ione,,0,"0.00,0.00,0.00,0.00,0.00,0.00,0.00,0.00,0.00,0.00,0.00,0.00",,0.00
báo giá booking quảng cáo ione.net,,0,"0.00,0.00,0.00,0.00,0.00,0.00,0.00,0.00,0.00,0.00,0.00,0.00",,0.00
báo giá booking saigon times,,0,"0.00,0.00,0.00,0.00,0.00,0.00,0.00,0.00,0.00,0.00,0.00,0.00",,0.00
báo giá booking saigontime,,0,"0.00,0.00,0.00,0.00,0.00,0.00,0.00,0.00,0.00,0.00,0.00,0.00",,0.00
báo giá booking saigontime quangcao,,0,"0.00,0.00,0.00,0.00,0.00,0.00,0.00,0.00,0.00,0.00,0.00,0.00",,0.00
báo giá booking shoha.vn,,0,"0.00,0.00,0.00,0.00,0.00,0.00,0.00,0.00,0.00,0.00,0.00,0.00",,0.00
báo giá booking soha.vn,,0,"0.00,0.00,0.00,0.00,0.00,0.00,0.00,0.00,0.00,0.00,0.00,0.00",,0.00
báo giá booking thesaigontimes,,0,"0.00,0.00,0.00,0.00,0.00,0.00,0.00,0.00,0.00,0.00,0.00,0.00",,0.00
báo giá booking trang merry,,0,"0.00,0.00,0.00,0.00,0.00,0.00,0.00,0.00,0.00,0.00,0.00,0.00",,0.00
báo giá booking tuoitre.vn,,0,"0.00,0.00,0.00,0.00,0.00,0.00,0.00,0.00,0.00,0.00,0.00,0.00",,0.00
báo giá booking tuổi trẻ,,0,"0.00,0.00,0.00,0.00,0.00,0.00,0.00,0.00,0.00,0.00,0.00,0.00",,0.00
báo giá booking vietnam news,,0,"0.00,0.00,0.00,0.00,0.00,0.00,0.00,0.00,0.00,0.00,0.00,0.00",,0.00
báo giá booking vietnamnet,,0,"0.00,0.00,0.00,0.00,0.00,0.00,0.00,0.00,0.00,0.00,0.00,0.00",,0.00
báo giá booking vietnamnews,,0,"0.00,0.00,0.00,0.00,0.00,0.00,0.00,0.00,0.00,0.00,0.00,0.00",,0.00
báo giá booking vietnamnews.vn,,0,"0.00,0.00,0.00,0.00,0.00,0.00,0.00,0.00,0.00,0.00,0.00,0.00",,0.00
báo giá booking vnexpress 2019,,0,"0.00,0.00,0.00,0.00,0.00,0.00,0.00,0.00,0.00,0.00,0.00,0.00",,0.00
báo giá booking youtube,,0,"0.00,0.00,0.00,0.00,0.00,0.00,0.00,0.00,0.00,0.00,0.00,0.00",,0.00
báo giá booking youtube channel,,0,"0.00,0.00,0.00,0.00,0.00,0.00,0.00,0.00,0.00,0.00,0.00,0.00",,0.00
báo giá life english book,,0,"0.00,0.00,0.00,0.00,0.00,0.00,0.00,0.00,0.00,0.00,0.00,0.00",,0.00
báo giá life english books,,0,"0.00,0.00,0.00,0.00,0.00,0.00,0.00,0.00,0.00,0.00,0.00,0.00",,0.00
báo giá surface pro book,,0,"0.00,0.00,0.00,0.00,0.00,0.00,0.00,0.00,0.00,0.00,0.00,0.00",,0.00
báo vlxd giá booking,,0,"0.00,0.00,0.00,0.00,0.00,0.00,0.00,0.00,0.00,0.00,0.00,0.00",,0.00
bảng giá book bài các báo,,0,"0.00,0.00,0.00,0.00,0.00,0.00,0.00,0.00,0.00,0.00,0.00,0.00",,0.00
bảng giá book báo tỉnh,,0,"0.00,0.00,0.00,0.00,0.00,0.00,0.00,0.00,0.00,0.00,0.00,0.00",,0.00
bảng giá booking banner báo 24h,,0,"0.00,0.00,0.00,0.00,0.00,0.00,0.00,0.00,0.00,0.00,0.00,0.00",,0.00
bảng giá booking banner báo batdongsan.com.vn,,0,"0.00,0.00,0.00,0.00,0.00,0.00,0.00,0.00,0.00,0.00,0.00,0.00",,0.00
bảng giá booking banner báo doanh nhân sài gofnn,,0,"0.00,0.00,0.00,0.00,0.00,0.00,0.00,0.00,0.00,0.00,0.00,0.00",,0.00
bảng giá booking banner báo nhipcaudautu,,0,"0.00,0.00,0.00,0.00,0.00,0.00,0.00,0.00,0.00,0.00,0.00,0.00",,0.00
bảng giá booking trên các fanpage báo chí,,0,"0.00,0.00,0.00,0.00,0.00,0.00,0.00,0.00,0.00,0.00,0.00,0.00",,0.00
chiến lược book bài báo chí,,0,"0.00,0.00,0.00,0.00,0.00,0.00,0.00,0.00,0.00,0.00,0.00,0.00",,0.00
chặn thông báo face book đến mail,,0,"0.00,0.00,0.00,0.00,0.00,0.00,0.00,0.00,0.00,0.00,0.00,0.00",,0.00
cài đặt tắt chuông báo face book,,0,"0.00,0.00,0.00,0.00,0.00,0.00,0.00,0.00,0.00,0.00,0.00,0.00",,0.00
các bước book bài trên báo mạng,,0,"0.00,0.00,0.00,0.00,0.00,0.00,0.00,0.00,0.00,0.00,0.00,0.00",,0.00
các câu thông báo bán hàng trên face book,,0,"0.00,0.00,0.00,0.00,0.00,0.00,0.00,0.00,0.00,0.00,0.00,0.00",,0.00
các hình thức book bài quảng cáo trên các báo,,0,"0.00,0.00,0.00,0.00,0.00,0.00,0.00,0.00,0.00,0.00,0.00,0.00",,0.00
các tham số cần quan tam khi book báo marketing,,0,"0.00,0.00,0.00,0.00,0.00,0.00,0.00,0.00,0.00,0.00,0.00,0.00",,0.00
cách book bài pr trên báo chí,,0,"0.00,0.00,0.00,0.00,0.00,0.00,0.00,0.00,0.00,0.00,0.00,0.00",,0.00
cách book bài trên báo mạng,,0,"0.00,0.00,0.00,0.00,0.00,0.00,0.00,0.00,0.00,0.00,0.00,0.00",,0.00
cách book bài viết trên báo mạng,,0,"0.00,0.00,0.00,0.00,0.00,0.00,0.00,0.00,0.00,0.00,0.00,0.00",,0.00
cách book bài viết trên báo mạng bread and tea,,0,"0.00,0.00,0.00,0.00,0.00,0.00,0.00,0.00,0.00,0.00,0.00,0.00",,0.00
cách book bài viết trên báo mạng vietnambooking,,0,"0.00,0.00,0.00,0.00,0.00,0.00,0.00,0.00,0.00,0.00,0.00,0.00",,0.00
cách tắt thông báo sinh nhật cho face book,,0,"0.00,0.00,0.00,0.00,0.00,0.00,0.00,0.00,0.00,0.00,0.00,0.00",,0.00
công ty truyền thông booking báo mạng,,0,"0.00,0.00,0.00,0.00,0.00,0.00,0.00,0.00,0.00,0.00,0.00,0.00",,0.00
dđơn vị chuyên nhận book báo,,0,"0.00,0.00,0.00,0.00,0.00,0.00,0.00,0.00,0.00,0.00,0.00,0.00",,0.00
dđơn vị chuyên nhận book báo mycro,,0,"0.00,0.00,0.00,0.00,0.00,0.00,0.00,0.00,0.00,0.00,0.00,0.00",,0.00
dịch vụ booking báo cafe f,,0,"0.00,0.00,0.00,0.00,0.00,0.00,0.00,0.00,0.00,0.00,0.00,0.00",,0.00
egency booking báo,,0,"0.00,0.00,0.00,0.00,0.00,0.00,0.00,0.00,0.00,0.00,0.00,0.00",,0.00
email thông báo cho khách số booking khách sạn,,0,"0.00,0.00,0.00,0.00,0.00,0.00,0.00,0.00,0.00,0.00,0.00,0.00",,0.00
face book báo không thể thay đổi tên trang,,0,"0.00,0.00,0.00,0.00,0.00,0.00,0.00,0.00,0.00,0.00,0.00,0.00",,0.00
face book báo lỗi vi phạm tiêu chuẩn cộng động,,0,"0.00,0.00,0.00,0.00,0.00,0.00,0.00,0.00,0.00,0.00,0.00,0.00",,0.00
face book báo something went wrong là bị gì,,0,"0.00,0.00,0.00,0.00,0.00,0.00,0.00,0.00,0.00,0.00,0.00,0.00",,0.00
face book báo đổi mật khẩu,,0,"0.00,0.00,0.00,0.00,0.00,0.00,0.00,0.00,0.00,0.00,0.00,0.00",,0.00
face book bị báo cáo mạo danh,,0,"0.00,0.00,0.00,0.00,0.00,0.00,0.00,0.00,0.00,0.00,0.00,0.00",,0.00
face book của nhà báo hoàng nguyên vũ,,0,"0.00,0.00,0.00,0.00,0.00,0.00,0.00,0.00,0.00,0.00,0.00,0.00",,0.00
giá booking báo dep365,,0,"0.00,0.00,0.00,0.00,0.00,0.00,0.00,0.00,0.00,0.00,0.00,0.00",,0.00
giá booking báo heritage,,0,"0.00,0.00,0.00,0.00,0.00,0.00,0.00,0.00,0.00,0.00,0.00,0.00",,0.00
giá booking báo kiến trúc đời sống,,0,"0.00,0.00,0.00,0.00,0.00,0.00,0.00,0.00,0.00,0.00,0.00,0.00",,0.00
giá booking báo tuổi trẻ,,0,"0.00,0.00,0.00,0.00,0.00,0.00,0.00,0.00,0.00,0.00,0.00,0.00",,0.00
hiển thị thông báo của face book chrome,,0,"0.00,0.00,0.00,0.00,0.00,0.00,0.00,0.00,0.00,0.00,0.00,0.00",,0.00
hoõ trợ booking báo mạng,,0,"0.00,0.00,0.00,0.00,0.00,0.00,0.00,0.00,0.00,0.00,0.00,0.00",,0.00
huong dân xóa thông báo trên face book,,0,"0.00,0.00,0.00,0.00,0.00,0.00,0.00,0.00,0.00,0.00,0.00,0.00",,0.00
hướng dẫn xóa thông báo trên face book,,0,"0.00,0.00,0.00,0.00,0.00,0.00,0.00,0.00,0.00,0.00,0.00,0.00",,0.00
hệ thống book bài pr trên các báo,,0,"0.00,0.00,0.00,0.00,0.00,0.00,0.00,0.00,0.00,0.00,0.00,0.00",,0.00
hỗ trợ booking báo mạng,,0,"0.00,0.00,0.00,0.00,0.00,0.00,0.00,0.00,0.00,0.00,0.00,0.00",,0.00
không nhận thông báo mời chơi game từ face book,,0,"0.00,0.00,0.00,0.00,0.00,0.00,0.00,0.00,0.00,0.00,0.00,0.00",,0.00
không vào được face book báo lỗi proxy,,0,"0.00,0.00,0.00,0.00,0.00,0.00,0.00,0.00,0.00,0.00,0.00,0.00",,0.00
kientrucvietnam.org.vn báo giá booking,,0,"0.00,0.00,0.00,0.00,0.00,0.00,0.00,0.00,0.00,0.00,0.00,0.00",,0.00
laàm sao biết ai báo cáo tên face book,,0,"0.00,0.00,0.00,0.00,0.00,0.00,0.00,0.00,0.00,0.00,0.00,0.00",,0.00
liên hệ booking báo,,0,"0.00,0.00,0.00,0.00,0.00,0.00,0.00,0.00,0.00,0.00,0.00,0.00",,0.00
liên hệ booking báo trực tuyến online,,0,"0.00,0.00,0.00,0.00,0.00,0.00,0.00,0.00,0.00,0.00,0.00,0.00",,0.00
làm thế nào để booking online trên báo nước ngoài,,0,"0.00,0.00,0.00,0.00,0.00,0.00,0.00,0.00,0.00,0.00,0.00,0.00",,0.00
làm thế nào để booking online trên báo nước ngào,,0,"0.00,0.00,0.00,0.00,0.00,0.00,0.00,0.00,0.00,0.00,0.00,0.00",,0.00
my book live báo đèn đỏ,,0,"0.00,0.00,0.00,0.00,0.00,0.00,0.00,0.00,0.00,0.00,0.00,0.00",,0.00
nghiệp vụ báo giá và xác nhận booking note,,0,"0.00,0.00,0.00,0.00,0.00,0.00,0.00,0.00,0.00,0.00,0.00,0.00",,0.00
statement of books báo cáo sổ sách,,0,"0.00,0.00,0.00,0.00,0.00,0.00,0.00,0.00,0.00,0.00,0.00,0.00",,0.00
style book của tờ báo,,0,"0.00,0.00,0.00,0.00,0.00,0.00,0.00,0.00,0.00,0.00,0.00,0.00",,0.00
thoông báo khai trương face book the coffee house,,0,"0.00,0.00,0.00,0.00,0.00,0.00,0.00,0.00,0.00,0.00,0.00,0.00",,0.00
thông báo khi booking trong wordpress,,0,"0.00,0.00,0.00,0.00,0.00,0.00,0.00,0.00,0.00,0.00,0.00,0.00",,0.00
thông báo messenger khi book trong wordpress,,0,"0.00,0.00,0.00,0.00,0.00,0.00,0.00,0.00,0.00,0.00,0.00,0.00",,0.00
thông báo thông báo khi book trong wordpress,,0,"0.00,0.00,0.00,0.00,0.00,0.00,0.00,0.00,0.00,0.00,0.00,0.00",,0.00
thông báo về việc giao nhận booking trễ,,0,"0.00,0.00,0.00,0.00,0.00,0.00,0.00,0.00,0.00,0.00,0.00,0.00",,0.00
thông báo đien lực đức thọ fa book hà tinh,,0,"0.00,0.00,0.00,0.00,0.00,0.00,0.00,0.00,0.00,0.00,0.00,0.00",,0.00
thông cáo báo chí thái hà books,,0,"0.00,0.00,0.00,0.00,0.00,0.00,0.00,0.00,0.00,0.00,0.00,0.00",,0.00
truyền thông booking báo mạng,,0,"0.00,0.00,0.00,0.00,0.00,0.00,0.00,0.00,0.00,0.00,0.00,0.00",,0.00
tạo tin báo trong face book,,0,"0.00,0.00,0.00,0.00,0.00,0.00,0.00,0.00,0.00,0.00,0.00,0.00",,0.00
tạp chí vật liệu xây dựng online báo giá booking,,0,"0.00,0.00,0.00,0.00,0.00,0.00,0.00,0.00,0.00,0.00,0.00,0.00",,0.00
tắt thông báo bằng mail của booking và agoda,,0,"0.00,0.00,0.00,0.00,0.00,0.00,0.00,0.00,0.00,0.00,0.00,0.00",,0.00
tắt thông báo mini face book,,0,"0.00,0.00,0.00,0.00,0.00,0.00,0.00,0.00,0.00,0.00,0.00,0.00",,0.00
tắtht ông báo live strem và video trên face book,,0,"0.00,0.00,0.00,0.00,0.00,0.00,0.00,0.00,0.00,0.00,0.00,0.00",,0.00
vacpa e book báo cáo tài chính,,0,"0.00,0.00,0.00,0.00,0.00,0.00,0.00,0.00,0.00,0.00,0.00,0.00",,0.00
vietnam booking báo,,0,"0.00,0.00,0.00,0.00,0.00,0.00,0.00,0.00,0.00,0.00,0.00,0.00",,0.00
đơn vị nhận book bài viết báo at my,,0,"0.00,0.00,0.00,0.00,0.00,0.00,0.00,0.00,0.00,0.00,0.00,0.00",,0.00
